Darkvision;Accustomed to life underground, you have superior vision in dark and dim conditions. You can see in dim light within 60 feet of you as if it were bright light, and in darkness as if it were dim light. You can't discern color in darkness, only shades of gray.;FALSE
Dwarven Armor Training;You have proficiency with light and medium armor.;TRUE
Dwarven Combat Training;You have proficiency with the Battleaxe, Handaxe, Light Hammer, and Warhammer.;TRUE
Dwarven Resilience;You have advantage on Saving Throws against poison, and you have Resistance against poison damage.;FALSE
Dwarven Toughness;Your hit point maximum increases by 1, and it increases by 1 every time you gain a level.;TRUE
Stonecunning;Whenever you make an Intelligence (History) check related to the Origin of stonework, you are considered proficient in the History skill and add double your Proficiency Bonus to the check, instead of your normal Proficiency Bonus.;FALSE
Tool Proficiency;You gain proficiency with the artisan's tools of your choice: smith's tools, brewer's supplies, or mason's tools.;TRUE